{
  "metadata": {
    "army_name": "Burning Death Speed Freeks",
    "source_url": "https://tp.net-armageddon.org/army-lists/ork-speed-freeks.html",
    "page_title": "Burning Death Speed Freeks Army List"
  },
  "army_stats": {
    "strategy_rating": "3",
    "initiative_rating": {
      "entries": [
        {
          "scope": "All formations",
          "value": "3+"
        }
      ]
    }
  },
  "special_rules": [
    {
      "id": "special_rules",
      "name": "Special Rules",
      "text": "The Mob Rule (see Mob Rule ) and Power of the Waaagh! (see Power of the Waaagh! ) rules apply to all Ork formations."
    }
  ],
  "formations": [
    {
      "id": "blitz_brigade",
      "category": "army_list",
      "entry_type": "formation",
      "name": "Blitz Brigade",
      "cost": "150 250 350",
      "units_text": "Any four of the following units: Deth Kopta, Flakwagon, Gunwagon",
      "upgrades_or_options_text": null,
      "restrictions_or_notes": "Add any number of the following units for +25 points each: Boyz, Guntrukk, Skorcha, Warbikes, Warbuggy\nAdd any number of the following units for +35 points each: Deth Kopta, Flakwagon, Gunwagon\nAdd up to one of the following units for +35 points each: Nobz (and a Trukk), Nob Warbikes\nAdd up to one Mekboy Speedsta for +50 points\nAdd any number of Gunfortresses for +125 points each",
      "raw_text": "Blitz Brigade | Any four of the following units: Deth Kopta, Flakwagon, Gunwagon | 150 | 250 | 350",
      "parse_warnings": []
    },
    {
      "id": "fortress_mob",
      "category": "army_list",
      "entry_type": "formation",
      "name": "Fortress Mob",
      "cost": "275 475 675",
      "units_text": "Any two of the following units: Battlefortress, Gunfortress",
      "upgrades_or_options_text": null,
      "restrictions_or_notes": "Add any number of Boyz for +25 points each\nAdd any number of Flakwagons for +35 points each\nAdd up to one of the following units for +35 points each: Nobz (and a Trukk), Nob Warbikes\nAdd any number of Battlefortresses for +115 points each\nAdd any number of Gunfortresses for +125 points each",
      "raw_text": "Fortress Mob | Any two of the following units: Battlefortress, Gunfortress | 275 | 475 | 675",
      "parse_warnings": []
    },
    {
      "id": "0_1_kill_kroozer",
      "category": "army_list",
      "entry_type": "formation",
      "name": "0–1 Kill Kroozer",
      "cost": "150 n/a n/a",
      "units_text": "One Kill Kroozer",
      "upgrades_or_options_text": null,
      "restrictions_or_notes": "Replace the Kill Kroozer with a Battlekroozer for +50 points",
      "raw_text": "0–1 Kill Kroozer | One Kill Kroozer | 150 | n/a | n/a",
      "parse_warnings": []
    },
    {
      "id": "kult_of_speed",
      "category": "army_list",
      "entry_type": "formation",
      "name": "Kult Of Speed",
      "cost": "200 350 500",
      "units_text": "Any eight of the following units: Guntrukk, Skorcha, Warbikes, Warbuggy",
      "upgrades_or_options_text": null,
      "restrictions_or_notes": "Add any number of the following units for +25 points each: Guntrukk, Skorcha, Warbikes, Warbuggy\nAdd any number of the following units for +35 points each: Deth Kopta, Flakwagon, Gunwagon\nAdd up to one Nob Warbikes for +35 points\nAdd up to one Mekboy Speedsta for +50 points",
      "raw_text": "Kult Of Speed | Any eight of the following units: Guntrukk, Skorcha, Warbikes, Warbuggy | 200 | 350 | 500",
      "parse_warnings": []
    },
    {
      "id": "warband",
      "category": "army_list",
      "entry_type": "formation",
      "name": "Warband",
      "cost": "200 375 550",
      "units_text": "One Nobz, three Boyz and four Trukks, plus any four of the following units: Guntrukk, Skorcha, Warbikes, Warbuggy",
      "upgrades_or_options_text": null,
      "restrictions_or_notes": "Add any number of the following units for +25 points each: Big Gunz, Boyz and a Trukk, Guntrukk, Skorcha, Stormboyz, Warbikes, Warbuggy\nAdd any number of the following units for +35 points each: Battlewagon, Deth Kopta, Flakwagon, Gunwagon\nAdd up to one Nobz (and a Trukk) for +35 points\nAdd up to one Mekboy Speedsta for +50 points\nReplace any number of Nobz (and a Trukk) with an equal number of Nob Warbikes for free",
      "raw_text": "Warband | One Nobz, three Boyz and four Trukks, plus any four of the following units: Guntrukk, Skorcha, Warbikes, Warbuggy | 200 | 375 | 550",
      "parse_warnings": []
    },
    {
      "id": "warbike_outriders",
      "category": "army_list",
      "entry_type": "formation",
      "name": "Warbike Outriders",
      "cost": "150 250 350",
      "units_text": "Five Warbikes",
      "upgrades_or_options_text": null,
      "restrictions_or_notes": "None\nNote: All units in the formation have Scout",
      "raw_text": "Warbike Outriders | Five Warbikes | 150 | 250 | 350",
      "parse_warnings": []
    },
    {
      "id": "fighta_sqwadron",
      "category": "army_list",
      "entry_type": "formation",
      "name": "Fighta Sqwadron",
      "cost": "150 n/a n/a",
      "units_text": "Three Fighter Bombers",
      "upgrades_or_options_text": null,
      "restrictions_or_notes": "Add up to six Fighter-Bombers for +50 points each",
      "raw_text": "Fighta Sqwadron | Three Fighter Bombers | 150 | n/a | n/a",
      "parse_warnings": []
    },
    {
      "id": "landa",
      "category": "army_list",
      "entry_type": "formation",
      "name": "Landa",
      "cost": "200 n/a n/a",
      "units_text": "One Landa",
      "upgrades_or_options_text": null,
      "restrictions_or_notes": "None",
      "raw_text": "Landa | One Landa | 200 | n/a | n/a",
      "parse_warnings": []
    }
  ],
  "profiles": [
    {
      "id": "big_gunz",
      "name": "Big Gunz",
      "type": "INF",
      "speed": "10cm",
      "armour": "-",
      "cc": "6+",
      "ff": "5+",
      "weapons": [
        {
          "name": "Big Gun",
          "range": "45cm",
          "firepower": "AP5+/AT5+",
          "notes": []
        }
      ],
      "abilities_or_notes": [],
      "source_section": "Speed Freek Forces",
      "parse_confidence": "high",
      "parse_warnings": [],
      "ambiguity_reasons": [],
      "is_reference_or_ambiguous": false
    },
    {
      "id": "boyz",
      "name": "Boyz",
      "type": "INF",
      "speed": "15cm",
      "armour": "6+",
      "cc": "4+",
      "ff": "6+",
      "weapons": [
        {
          "name": "Big Shoota",
          "range": "30cm",
          "firepower": "AP6+/AT6+",
          "notes": []
        }
      ],
      "abilities_or_notes": [],
      "source_section": "Speed Freek Forces",
      "parse_confidence": "high",
      "parse_warnings": [],
      "ambiguity_reasons": [],
      "is_reference_or_ambiguous": false
    },
    {
      "id": "mekboy_bad_ork_bikerboy",
      "name": "Mekboy Bad Ork Bikerboy",
      "type": "INF",
      "speed": "40cm",
      "armour": "5+",
      "cc": "4+",
      "ff": "5+",
      "weapons": [
        {
          "name": "Sawn-Off Custom Blasta",
          "range": "15cm",
          "firepower": "MW5+",
          "notes": [
            "MW"
          ]
        },
        {
          "name": "Sawn-Off Custom Blasta",
          "range": "(15cm)",
          "firepower": "Small Arms",
          "notes": [
            "EA(+1)",
            "MW"
          ]
        },
        {
          "name": "Choppa Blades",
          "range": "(bc)",
          "firepower": "Assault Weapons",
          "notes": [
            "EA(+1)",
            "MW"
          ]
        }
      ],
      "abilities_or_notes": [
        "Invulnerable Save",
        "Mounted",
        "Supreme Commander"
      ],
      "source_section": "Speed Freek Forces",
      "parse_confidence": "high",
      "parse_warnings": [
        "Boolean weapon line folded into previous weapon for Mekboy Bad Ork Bikerboy."
      ],
      "ambiguity_reasons": [],
      "is_reference_or_ambiguous": false
    },
    {
      "id": "nob_warbikes",
      "name": "Nob Warbikes",
      "type": "INF",
      "speed": "35cm",
      "armour": "4+",
      "cc": "3+",
      "ff": "5+",
      "weapons": [
        {
          "name": "2x Big Shoota",
          "range": "30cm",
          "firepower": "AP6+/AT6+",
          "notes": []
        },
        {
          "name": "Big Choppas",
          "range": "(bc)",
          "firepower": "Assault Weapons",
          "notes": [
            "EA(+1)"
          ]
        }
      ],
      "abilities_or_notes": [
        "Leader",
        "Mounted"
      ],
      "source_section": "Speed Freek Forces",
      "parse_confidence": "high",
      "parse_warnings": [],
      "ambiguity_reasons": [],
      "is_reference_or_ambiguous": false
    },
    {
      "id": "nobz",
      "name": "Nobz",
      "type": "INF",
      "speed": "15cm",
      "armour": "4+",
      "cc": "3+",
      "ff": "5+",
      "weapons": [
        {
          "name": "2x Big Shoota",
          "range": "30cm",
          "firepower": "AP6+/AT6+",
          "notes": []
        },
        {
          "name": "Big Choppas",
          "range": "(bc)",
          "firepower": "Assault Weapons",
          "notes": [
            "EA(+1)"
          ]
        }
      ],
      "abilities_or_notes": [
        "Leader"
      ],
      "source_section": "Speed Freek Forces",
      "parse_confidence": "high",
      "parse_warnings": [],
      "ambiguity_reasons": [],
      "is_reference_or_ambiguous": false
    },
    {
      "id": "stormboyz",
      "name": "Stormboyz",
      "type": "INF",
      "speed": "30cm",
      "armour": "6+",
      "cc": "4+",
      "ff": "6+",
      "weapons": [
        {
          "name": "Shootas",
          "range": "(15cm)",
          "firepower": "Small Arms",
          "notes": []
        }
      ],
      "abilities_or_notes": [
        "Jump Packs",
        "Scout"
      ],
      "source_section": "Speed Freek Forces",
      "parse_confidence": "high",
      "parse_warnings": [],